[
  {
    "schema_version": "1.0.0",
    "id": "kb:snake_plant_taxonomy_001",
    "plant_id": "plant:dracaena_trifasciata",
    "language": "zh-CN",
    "dimension": "taxonomy",
    "topics": ["accepted_name", "synonym", "family"],
    "claim_type": "fact",
    "content": "虎尾兰的接受学名为 Dracaena trifasciata，隶属天门冬科（Asparagaceae）龙血树属（Dracaena）；Sansevieria trifasciata 是其旧名/异名。",
    "conditions": [],
    "retrieval": {
      "aliases": ["虎尾兰", "虎皮兰", "Dracaena trifasciata", "Sansevieria trifasciata", "Snake plant"],
      "intents": ["identify", "learn"],
      "symptoms": []
    },
    "source_refs": [
      {"source_id": "source:gbif_dracaena_trifasciata", "locator": "Classification and Synonyms", "support": "paraphrase"}
    ],
    "review_status": "approved",
    "updated_at": "2026-08-11"
  },
  {
    "schema_version": "1.0.0",
    "id": "kb:snake_plant_lighting_001",
    "plant_id": "plant:dracaena_trifasciata",
    "language": "zh-CN",
    "dimension": "lighting",
    "topics": ["partial_sun", "low_light_tolerance"],
    "claim_type": "fact",
    "content": "虎尾兰可放在每天仅部分时段有直射光的位置，也能耐受很弱的光照。",
    "conditions": ["耐弱光不代表弱光下生长最佳"],
    "retrieval": {
      "aliases": ["虎尾兰", "虎皮兰", "Snake plant"],
      "intents": ["care", "learn"],
      "symptoms": []
    },
    "source_refs": [
      {"source_id": "source:ncsu_dracaena_trifasciata", "locator": "Description, paragraph 2", "support": "paraphrase"}
    ],
    "review_status": "approved",
    "updated_at": "2026-08-11"
  },
  {
    "schema_version": "1.0.0",
    "id": "kb:snake_plant_watering_001",
    "plant_id": "plant:dracaena_trifasciata",
    "language": "zh-CN",
    "dimension": "watering",
    "topics": ["soil_dryness", "seasonal_watering"],
    "claim_type": "recommendation",
    "content": "虎尾兰从春季到秋季应在两次浇水间让土壤干燥；冬季需显著减少浇水，来源给出的参考间隔为一到两个月。",
    "conditions": ["室内容器栽培", "具体间隔仍受温度、光照、盆土和盆器影响"],
    "retrieval": {
      "aliases": ["虎尾兰", "虎皮兰", "Snake plant"],
      "intents": ["care", "diagnose"],
      "symptoms": ["多久浇水", "冬季浇水", "土一直湿"]
    },
    "source_refs": [
      {"source_id": "source:ncsu_dracaena_trifasciata", "locator": "Description, paragraph 2", "support": "paraphrase"}
    ],
    "review_status": "approved",
    "updated_at": "2026-08-11"
  },
  {
    "schema_version": "1.0.0",
    "id": "kb:snake_plant_symptom_overwatering_001",
    "plant_id": "plant:dracaena_trifasciata",
    "language": "zh-CN",
    "dimension": "symptom",
    "topics": ["overwatering", "root_rot"],
    "claim_type": "diagnostic_association",
    "content": "虎尾兰浇水过多可能引发根腐；怀疑时应结合土壤是否长期潮湿、盆器排水和根系状态继续检查。",
    "conditions": ["不能仅凭叶片症状确诊根腐"],
    "retrieval": {
      "aliases": ["虎尾兰", "虎皮兰", "Snake plant"],
      "intents": ["diagnose"],
      "symptoms": ["烂根", "根腐", "浇水太多", "土一直湿"]
    },
    "source_refs": [
      {"source_id": "source:ncsu_dracaena_trifasciata", "locator": "Insects, Diseases, and Other Plant Problems", "support": "paraphrase"}
    ],
    "review_status": "approved",
    "updated_at": "2026-08-11"
  },
  {
    "schema_version": "1.0.0",
    "id": "kb:snake_plant_watering_frequency_001",
    "plant_id": "plant:dracaena_trifasciata",
    "language": "zh-CN",
    "dimension": "watering",
    "topics": ["watering_frequency_practical", "soil_dryness", "seasonal_watering"],
    "claim_type": "recommendation",
    "answer_shape": "numeric_request",
    "content": "虎尾兰可把每隔数周检查一次作为粗略参考，只有盆土已经干燥时才浇；冬季参考间隔可延长到 1–2 个月，不能无视环境固定按周浇水。",
    "conditions": ["室内容器栽培", "光照弱、温度低或盆土保水强时需进一步延长"],
    "retrieval": {
      "aliases": ["虎尾兰", "虎皮兰", "Dracaena trifasciata", "Sansevieria trifasciata", "Snake plant"],
      "intents": ["care"],
      "symptoms": ["how often to water snake plant", "watering schedule", "多久浇一次", "几周浇水"]
    },
    "source_refs": [
      {"source_id": "source:uvm_snake_plant", "locator": "Snake plant care paragraph, water every few weeks", "support": "paraphrase"},
      {"source_id": "source:ncsu_dracaena_trifasciata", "locator": "Description, seasonal watering", "support": "paraphrase"}
    ],
    "review_status": "approved",
    "updated_at": "2026-08-11"
  },
  {
    "schema_version": "1.0.0",
    "id": "kb:snake_plant_watering_method_001",
    "plant_id": "plant:dracaena_trifasciata",
    "language": "zh-CN",
    "dimension": "watering",
    "topics": ["watering_amount_practical", "drainage", "empty_saucer"],
    "claim_type": "recommendation",
    "answer_shape": "recommendation",
    "content": "虎尾兰每次浇水应让水均匀湿润基质并从排水孔流出，随后倒掉托盘或外盆积水；不宜按固定毫升数浇，因为盆径、基质和根量会改变所需水量。",
    "conditions": ["花盆必须有排水孔", "浇水前盆土已干燥"],
    "retrieval": {
      "aliases": ["虎尾兰", "虎皮兰", "Snake plant", "Sansevieria"],
      "intents": ["care"],
      "symptoms": ["how much water", "water until drains", "watering amount", "一次浇多少", "浇透"]
    },
    "source_refs": [
      {"source_id": "source:rhs_sansevieria_growing", "locator": "Ongoing Care, Watering", "support": "paraphrase"},
      {"source_id": "source:vtech_houseplant_watering", "locator": "Watering Methods and drainage guidance", "support": "paraphrase"}
    ],
    "review_status": "approved",
    "updated_at": "2026-08-11"
  },
  {
    "schema_version": "1.0.0",
    "id": "kb:snake_plant_pet_safety_001",
    "plant_id": "plant:dracaena_trifasciata",
    "language": "zh-CN",
    "dimension": "pet_safety",
    "topics": ["cats", "dogs", "saponins", "ingestion"],
    "claim_type": "safety",
    "answer_shape": "yes_no",
    "content": "虎尾兰对猫和狗有毒，主要毒性成分为皂苷；误食后可能出现恶心、呕吐或腹泻，疑似摄入时应尽快联系兽医或动物毒物咨询机构。",
    "conditions": ["宠物接触或疑似摄入", "不替代兽医诊断"],
    "retrieval": {
      "aliases": ["虎尾兰", "虎皮兰", "Dracaena trifasciata", "Sansevieria trifasciata", "Snake plant", "Mother-in-law's tongue"],
      "intents": ["safety"],
      "symptoms": ["safe for cats", "poisonous to cats", "cat ate snake plant", "猫能不能碰", "宠物误食"]
    },
    "source_refs": [
      {"source_id": "source:aspca_dracaena_trifasciata", "locator": "Scientific Name, Toxicity, Toxic Principles, Clinical Signs", "support": "paraphrase"},
      {"source_id": "source:ncsu_dracaena_trifasciata", "locator": "Poisonous to Humans and Problems attributes", "support": "paraphrase"}
    ],
    "review_status": "approved",
    "updated_at": "2026-08-11"
  },
  {
    "schema_version": "1.0.0",
    "id": "kb:snake_plant_symptom_overwatering_signs_001",
    "plant_id": "plant:dracaena_trifasciata",
    "language": "zh-CN",
    "dimension": "symptom",
    "topics": ["overwatering", "yellow_leaves", "mushy_leaves", "leaf_drop"],
    "claim_type": "diagnostic_association",
    "answer_shape": "diagnosis_list",
    "content": "虎尾兰盆土长期潮湿时，过湿可能表现为新老叶黄化、叶片或茎基部发软发糊、叶片脱落或盆土有腐败气味；这些线索应与根系检查和排水状况一起判断。",
    "conditions": ["通用过湿症状与虎尾兰根腐风险的组合判断", "不能仅凭一片黄叶确诊"],
    "retrieval": {
      "aliases": ["虎尾兰", "虎皮兰", "Snake plant", "Sansevieria"],
      "intents": ["diagnose"],
      "symptoms": ["yellow soft leaves", "mushy base", "leaves fall over", "soggy soil", "叶子发黄发软", "倒伏"]
    },
    "source_refs": [
      {"source_id": "source:vtech_houseplant_watering", "locator": "Symptoms of Moisture Stress, Overwatered Symptoms", "support": "paraphrase"},
      {"source_id": "source:ncsu_dracaena_trifasciata", "locator": "Insects, Diseases, and Other Plant Problems, root rot", "support": "paraphrase"}
    ],
    "review_status": "approved",
    "updated_at": "2026-08-11"
  },
  {
    "schema_version": "1.0.0",
    "id": "kb:snake_plant_symptom_underwatering_001",
    "plant_id": "plant:dracaena_trifasciata",
    "language": "zh-CN",
    "dimension": "symptom",
    "topics": ["underwatering", "brown_edges", "dry_brittle_leaves", "curling"],
    "claim_type": "diagnostic_association",
    "answer_shape": "diagnosis_list",
    "content": "虎尾兰缺水时可出现叶片干脆、叶尖或叶缘褐变、卷曲或生长减慢，并常伴随盆土干缩、盆体明显变轻；这些干性表现与过湿时的柔软糊烂不同。",
    "conditions": ["属于通用室内盆栽缺水线索", "需结合虎尾兰盆土是否完全干燥判断"],
    "retrieval": {
      "aliases": ["虎尾兰", "虎皮兰", "Snake plant", "Sansevieria"],
      "intents": ["diagnose"],
      "symptoms": ["underwatered snake plant", "brown tips", "dry brittle leaves", "curling leaves", "叶尖干枯", "缺水"]
    },
    "source_refs": [
      {"source_id": "source:vtech_houseplant_watering", "locator": "Symptoms of Moisture Stress, Underwatered Symptoms", "support": "paraphrase"},
      {"source_id": "source:ncsu_dracaena_trifasciata", "locator": "Description, dry soil and seasonal watering", "support": "paraphrase"}
    ],
    "review_status": "approved",
    "updated_at": "2026-08-11"
  }
]
